{
  "schema_version": 1,
  "generated_at": "2026-09-09T05:00:14.279431+00:00",
  "corpus": {
    "sha256": "4ad85de87665defd4fdfbe9eca89884a9f1f8fa228fd005c4afc45c862bc2ce7",
    "files": [
      {
        "corpus_id": "koguard-provisional-ablation-v1",
        "sha256": "8d08bea11eff313f0c7ba6cf19aea6b90d5255083d1053308619f6c303e337df"
      }
    ],
    "case_count": 20,
    "evaluated_case_count": 20,
    "excluded_review_count": 0
  },
  "runner": {
    "name": "koguard-comparison-runner",
    "version": "1",
    "python_version": "3.11.9",
    "implementation": "CPython",
    "platform": "Windows-10-10.0.26200-SP0",
    "configuration_sha256": "02a61cca97fd5d84c64a71ba9bd76432556e825805985ee5a0a1d538c7f845dc"
  },
  "detectors": [
    {
      "detector_id": "koguard",
      "artifact": {
        "package": "koguard",
        "version": "0.1.0",
        "filename": "koguard-0.1.0-py3-none-any.whl",
        "sha256": "f5e5e13ed31b6cf88e586476b0259391723c4566e57d2b48dbb91f181d17f3ec",
        "size_bytes": 43783
      },
      "profile": "current-all-enabled",
      "settings": {
        "alias_matching": true,
        "choseong_matching": true,
        "exact_matching": true,
        "fuzzy_matching": true,
        "fuzzy_max_distance": 1,
        "fuzzy_max_index_entries": 100000,
        "fuzzy_max_operations": 250000,
        "fuzzy_max_term_length": 32,
        "fuzzy_min_score": 0.0,
        "fuzzy_min_term_length": 3,
        "jamo_composition_matching": true,
        "keyboard_matching": true,
        "max_input_length": 4096,
        "max_whitespace_gap": 3,
        "mixed_gap_matching": true,
        "obfuscation_separators": "!#$%&*+,-.=@^_~·",
        "repeat_reduction_threshold": 2,
        "repeated_matching": true,
        "segmented_input_matching": true,
        "separator_matching": true,
        "unicode_form": "NFKC",
        "whitespace_gap_matching": true
      },
      "capabilities": {
        "sentence": true,
        "occurrences": true,
        "spans": true,
        "canonical_terms": true
      },
      "runtime": {
        "python_version": "3.11.9",
        "implementation": "CPython",
        "platform": "Windows-10-10.0.26200-SP0",
        "dependencies": [],
        "suppressed_output": false
      },
      "sentence_metrics": {
        "counts": {
          "tp": 13,
          "fp": 0,
          "fn": 3,
          "tn": 4
        },
        "precision": 1.0,
        "recall": 0.8125,
        "f1": 0.896551724137931,
        "accuracy": 0.85
      },
      "occurrence_metrics": {
        "status": "available",
        "exact": {
          "counts": {
            "tp": 13,
            "fp": 0,
            "fn": 3
          },
          "precision": 1.0,
          "recall": 0.8125,
          "f1": 0.896551724137931
        },
        "span": {
          "counts": {
            "tp": 13,
            "fp": 0,
            "fn": 3
          },
          "precision": 1.0,
          "recall": 0.8125,
          "f1": 0.896551724137931
        },
        "canonical": {
          "counts": {
            "tp": 13,
            "fp": 0,
            "fn": 3
          },
          "precision": 1.0,
          "recall": 0.8125,
          "f1": 0.896551724137931
        }
      },
      "slice_metrics": [
        {
          "slice": "alias",
          "case_count": 1,
          "sentence_metrics": {
            "counts": {
              "tp": 1,
              "fp": 0,
              "fn": 0,
              "tn": 0
            },
            "precision": 1.0,
            "recall": 1.0,
            "f1": 1.0,
            "accuracy": 1.0
          },
          "occurrence_metrics": {
            "status": "available",
            "exact": {
              "counts": {
                "tp": 1,
                "fp": 0,
                "fn": 0
              },
              "precision": 1.0,
              "recall": 1.0,
              "f1": 1.0
            },
            "span": {
              "counts": {
                "tp": 1,
                "fp": 0,
                "fn": 0
              },
              "precision": 1.0,
              "recall": 1.0,
              "f1": 1.0
            },
            "canonical": {
              "counts": {
                "tp": 1,
                "fp": 0,
                "fn": 0
              },
              "precision": 1.0,
              "recall": 1.0,
              "f1": 1.0
            }
          }
        },
        {
          "slice": "benign-substring",
          "case_count": 4,
          "sentence_metrics": {
            "counts": {
              "tp": 2,
              "fp": 0,
              "fn": 0,
              "tn": 2
            },
            "precision": 1.0,
            "recall": 1.0,
            "f1": 1.0,
            "accuracy": 1.0
          },
          "occurrence_metrics": {
            "status": "available",
            "exact": {
              "counts": {
                "tp": 2,
                "fp": 0,
                "fn": 0
              },
              "precision": 1.0,
              "recall": 1.0,
              "f1": 1.0
            },
            "span": {
              "counts": {
                "tp": 2,
                "fp": 0,
                "fn": 0
              },
              "precision": 1.0,
              "recall": 1.0,
              "f1": 1.0
            },
            "canonical": {
              "counts": {
                "tp": 2,
                "fp": 0,
                "fn": 0
              },
              "precision": 1.0,
              "recall": 1.0,
              "f1": 1.0
            }
          }
        },
        {
          "slice": "choseong",
          "case_count": 2,
          "sentence_metrics": {
            "counts": {
              "tp": 1,
              "fp": 0,
              "fn": 1,
              "tn": 0
            },
            "precision": 1.0,
            "recall": 0.5,
            "f1": 0.6666666666666666,
            "accuracy": 0.5
          },
          "occurrence_metrics": {
            "status": "available",
            "exact": {
              "counts": {
                "tp": 1,
                "fp": 0,
                "fn": 1
              },
              "precision": 1.0,
              "recall": 0.5,
              "f1": 0.6666666666666666
            },
            "span": {
              "counts": {
                "tp": 1,
                "fp": 0,
                "fn": 1
              },
              "precision": 1.0,
              "recall": 0.5,
              "f1": 0.6666666666666666
            },
            "canonical": {
              "counts": {
                "tp": 1,
                "fp": 0,
                "fn": 1
              },
              "precision": 1.0,
              "recall": 0.5,
              "f1": 0.6666666666666666
            }
          }
        },
        {
          "slice": "direct",
          "case_count": 1,
          "sentence_metrics": {
            "counts": {
              "tp": 1,
              "fp": 0,
              "fn": 0,
              "tn": 0
            },
            "precision": 1.0,
            "recall": 1.0,
            "f1": 1.0,
            "accuracy": 1.0
          },
          "occurrence_metrics": {
            "status": "available",
            "exact": {
              "counts": {
                "tp": 1,
                "fp": 0,
                "fn": 0
              },
              "precision": 1.0,
              "recall": 1.0,
              "f1": 1.0
            },
            "span": {
              "counts": {
                "tp": 1,
                "fp": 0,
                "fn": 0
              },
              "precision": 1.0,
              "recall": 1.0,
              "f1": 1.0
            },
            "canonical": {
              "counts": {
                "tp": 1,
                "fp": 0,
                "fn": 0
              },
              "precision": 1.0,
              "recall": 1.0,
              "f1": 1.0
            }
          }
        },
        {
          "slice": "domain-term",
          "case_count": 1,
          "sentence_metrics": {
            "counts": {
              "tp": 0,
              "fp": 0,
              "fn": 0,
              "tn": 1
            },
            "precision": null,
            "recall": null,
            "f1": null,
            "accuracy": 1.0
          },
          "occurrence_metrics": {
            "status": "available",
            "exact": {
              "counts": {
                "tp": 0,
                "fp": 0,
                "fn": 0
              },
              "precision": null,
              "recall": null,
              "f1": null
            },
            "span": {
              "counts": {
                "tp": 0,
                "fp": 0,
                "fn": 0
              },
              "precision": null,
              "recall": null,
              "f1": null
            },
            "canonical": {
              "counts": {
                "tp": 0,
                "fp": 0,
                "fn": 0
              },
              "precision": null,
              "recall": null,
              "f1": null
            }
          }
        },
        {
          "slice": "fuzzy",
          "case_count": 1,
          "sentence_metrics": {
            "counts": {
              "tp": 1,
              "fp": 0,
              "fn": 0,
              "tn": 0
            },
            "precision": 1.0,
            "recall": 1.0,
            "f1": 1.0,
            "accuracy": 1.0
          },
          "occurrence_metrics": {
            "status": "available",
            "exact": {
              "counts": {
                "tp": 1,
                "fp": 0,
                "fn": 0
              },
              "precision": 1.0,
              "recall": 1.0,
              "f1": 1.0
            },
            "span": {
              "counts": {
                "tp": 1,
                "fp": 0,
                "fn": 0
              },